### ISSUE TITLE
Cannot reach floating IP from outside network

### ISSUE THREAD

**Issue by AJNOURI** [AJNOURI/COA#60]
**Host OS**  
Distributor ID:	Debian  
Description:	Debian GNU/Linux 8.6 (jessie)  
Release:	8.6  
Codename:	jessie  

**Openstack Environement**  
RDO All-In-One installed on VMware workstation VM + Centos7    

------------ 

[During installation, Openstack is configured to use the external interface (192.168.0.[1-155]/24) (connecting VM to host) as "public" network.](https://ask.openstack.org/en/question/103568/map-vm-floating-ip-to-outside-ip-to-access-vm-instance/).  
Configured a subnet range for floating IPs (not assigned by external network:192.168.0.[170-199]/24).  
Created an instance, assigned a floating IP  (192.168.0.176).  

**Results:**  
==> Can ping/ssh to instance from within Openstack, but not from outside.  

**Observations:**  
I can observe the floatng IP (192.168.0.176) assigned to router external interface  

    [root@RDO-AIO ~(keystone_admin)]# ip netns exec qrouter-a2dd3739-fe62-4e79-8795-e3023419dc30 ip a
    1: lo: <LOOPBACK,UP,LOWER_UP> mtu 65536 qdisc noqueue state UNKNOWN qlen 1
        link/loopback 00:00:00:00:00:00 brd 00:00:00:00:00:00
        inet 127.0.0.1/8 scope host lo
           valid_lft forever preferred_lft forever
        inet6 ::1/128 scope host 
           valid_lft forever preferred_lft forever
    9: qg-913f6089-a8: <BROADCAST,MULTICAST,UP,LOWER_UP> mtu 1500 qdisc noqueue state UNKNOWN qlen 1000
        link/ether fa:16:3e:31:a4:f9 brd ff:ff:ff:ff:ff:ff
        inet 192.168.0.173/24 brd 192.168.0.255 scope global qg-913f6089-a8
           valid_lft forever preferred_lft forever
        inet 192.168.0.176/32 brd 192.168.0.176 scope global qg-913f6089-a8
           valid_lft forever preferred_lft forever
        inet6 f816:3eff:fe31:a4f9/64 scope global mngtmpaddr dynamic 
           valid_lft 86318sec preferred_lft 86318sec
        inet6 fe80::f816:3eff:fe31:a4f9/64 scope link 
           valid_lft forever preferred_lft forever

routing and arp on openstack looks OK

    [root@RDO-AIO ~(keystone_admin)]# route
    Kernel IP routing table
    Destination     Gateway         Genmask         Flags Metric Ref    Use Iface
    default         gateway         0.0.0.0         UG    0      0        0 br-ex
    link-local      0.0.0.0         255.255.0.0     U     1002   0        0 eno16777736
    link-local      0.0.0.0         255.255.0.0     U     1006   0        0 br-ex
    192.168.0.0     0.0.0.0         255.255.255.0   U     0      0        0 br-ex
    [root@RDO-AIO ~(keystone_admin)]# 
    [root@RDO-AIO ~(keystone_admin)]# arp
    Address                  HWtype  HWaddress           Flags Mask            Iface
    192.168.0.146            ether   b4:b5:2f:b1:fa:ec   C                     br-ex
    192.168.0.2              ether   a2:c6:c7:14:c5:49   C                     br-ex
    192.168.0.173            ether   fa:16:3e:31:a4:f9   C                     br-ex
    192.168.0.176            ether   fa:16:3e:31:a4:f9   C                     br-ex
    gateway                  ether   f4:ca:e5:4c:ed:44   C                     br-ex

From Openstack host, I can see the ping coming but Openstack not forwarding it to the router namespace:

    [root@RDO-AIO ~(keystone_admin)]# tcpdump icmp
    tcpdump: verbose output suppressed, use -v or -vv for full protocol decode
    listening on br-ex, link-type EN10MB (Ethernet), capture size 65535 bytes
    01:38:08.197502 IP 192.168.0.146 > 192.168.0.176: ICMP echo request, id 29797, seq 1, length 64
    01:38:09.196384 IP 192.168.0.146 > 192.168.0.176: ICMP echo request, id 29797, seq 2, length 64
    01:38:10.196327 IP 192.168.0.146 > 192.168.0.176: ICMP echo request, id 29797, seq 3, length 64
    01:38:11.196384 IP 192.168.0.146 > 192.168.0.176: ICMP echo request, id 29797, seq 4, length 64
    01:38:12.196386 IP 192.168.0.146 > 192.168.0.176: ICMP echo request, id 29797, seq 5, length 64
    01:38:13.196380 IP 192.168.0.146 > 192.168.0.176: ICMP echo request, id 29797, seq 6, length 64

**Comment by robertluwang** [comment]
Any news about this issue?

I got same issue here, 172.25.250.26 is floating ip, I cannot ping it in netns.

Looks like the issue is with 172.25.250.26/32, it should be 172.25.250.26/24 ??

sudo ip netns exec qrouter-cc374cbb-81b7-4fff-a3f2-37854a222fd6 ip addr

20: qg-35b948f7-71: <BROADCAST,MULTICAST,UP,LOWER_UP> mtu 1500 qdisc noqueue state UNKNOWN qlen 1000
    link/ether fa:16:3e:d3:06:dc brd ff:ff:ff:ff:ff:ff
    inet 172.25.250.28/24 brd 172.25.250.255 scope global qg-35b948f7-71
       valid_lft forever preferred_lft forever
    inet 172.25.250.26/32 brd 172.25.250.26 scope global qg-35b948f7-71
       valid_lft forever preferred_lft forever
    inet6 fe80::f816:3eff:fed3:6dc/64 scope link
       valid_lft forever preferred_lft forever

**Comment by nahian166** [comment]
For now, It can be allowed-address-pair issue. I can ensure you later after trying it again. But I had such kinda issue earlier.

**Comment by richardsith** [comment]
hi guys, I've the same issue, here is my [post](https://ask.openstack.org/en/question/119783/no-route-to-instance-ssh-and-ping-no-route-to-host/) with all informations about my lab. Someone can help me thanks.
