### ISSUE TITLE
RDO AIO : VM not reaching Internet / outside (host) networks

### ISSUE THREAD

**Issue by AJNOURI** [AJNOURI/COA#37]
br-ext interface, which is supposed to connect to host network and from there to Internet, was DOWN.
And no IP address configured.

**Troubleshooting:**
Brought the interface br-ext UP and pinging 8.8.8.8 from a started VM and sniffing the host **br-ext i**nterface, which is supposed to connect to host network and from there to Internet, I could see the arp messages from the VM not able to reach the default gateway on the router:

![selection_529](https://cloud.githubusercontent.com/assets/1716020/20302606/36e9f858-ab28-11e6-972c-f05f3ddd6cdb.png)

  
  
  

`tcpdump -i br-ex`

> tcpdump: WARNING: br-ex: no IPv4 address assigned
> tcpdump: verbose output suppressed, use -v or -vv for full protocol decode
> listening on br-ex, link-type EN10MB (Ethernet), capture size 65535 bytes
> 10:59:50.418966 ARP, Request who-has 172.24.4.225 tell 172.24.4.231, length 28
> 10:59:51.420156 ARP, Request who-has 172.24.4.225 tell 172.24.4.231, length 28
> 10:59:52.422163 ARP, Request who-has 172.24.4.225 tell 172.24.4.231, length 28
> 10:59:54.421406 ARP, Request who-has 172.24.4.225 tell 172.24.4.231, length 28
> 10:59:55.422171 ARP, Request who-has 172.24.4.225 tell 172.24.4.231, length 28
> 10:59:56.424161 ARP, Request who-has 172.24.4.225 tell 172.24.4.231, length 28

**Comment by AJNOURI** [comment]
The solution was 
**1) Set the interface br-ex with the router gateway IP**
`sudo ip a a 172.24.4.225/28 dev br-ex`

**2) Set NAT on the host using iptables to allow traffic from br-ex to go outside using host IP**

```
iptables -I FORWARD -i br-ex -j ACCEPT 
iptables -I FORWARD -o br-ex -j ACCEPT
sudo iptables -t nat -I POSTROUTING -s 172.24.4.0/28 ! -d 172.24.4.0/28 -j MASQUERADE
```

Now works like a charm:
![selection_533](https://cloud.githubusercontent.com/assets/1716020/20302923/57ed342e-ab29-11e6-8944-2b1e41d27e3a.png)

**Comment by AJNOURI** [comment]
The solution is top put the cloud public GW IP (172.24.4.225) on the br-ex bridge and configure NAT to allow traffic from 172.24.4.0/28 (default RDO AIO public network) to go outside the interface econnected to your outside world (eno1677736 in the case of  RDO AIO default settings):

### **Temporary settings**
enable routing (/etc/sysctl.conf)
`sysctl -w net.ipv4.ip_forward = 1`

Bring br-ex interface up and set its ip to router GW:
```
ifconfig br-ex up
ip a a 172.24.4.225/28 dev br-ex

```
Configure NAT on br-ex
```
iptables -I FORWARD -i br-ex -j ACCEPT 
iptables -I FORWARD -o br-ex -j ACCEPT
iptables -t nat -I POSTROUTING -s 172.24.4.0/28 ! -d 172.24.4.0/28 -j MASQUERADE
```

### **Persistent settings:**

`vi accessoutside`

```
#!/bin/bash
sysctl -w net.ipv4.ip_forward = 1
ifconfig br-ex up
ip a a 172.24.4.225/28 dev br-ex
iptables -I FORWARD -i br-ex -j ACCEPT 
iptables -I FORWARD -o br-ex -j ACCEPT
iptables -t nat -I POSTROUTING -s 172.24.4.0/28 ! -d 172.24.4.0/28 -j MASQUERADE
```

Then make the script load at start:
```
cp accessoutside /etc/init.d/accessoutside
echo "/etc/init.d/accessoutside" >> /etc/rc.local

```
